"case_id","expected_result","coverage"
"missing_mission","RED_QUEUE_EXECUTOR_BLOCKED","Mission path must exist."
"mission_outside_queue","RED_QUEUE_EXECUTOR_BLOCKED","Mission must start inside a known queue state."
"invalid_start_state","RED_QUEUE_EXECUTOR_BLOCKED","Executor starts only from inbox or drafted in V1."
"invalid_transition","RED_QUEUE_EXECUTOR_BLOCKED","State transitions go through Move-TsfMissionState.ps1."
"missing_approval","TIM_REQUIRED_QUEUE_PREFLIGHT_BLOCKED","Kernel exact approval must be satisfied."
"role_permission_block","RED_QUEUE_ROLE_BLOCKED","Role-aware permission preflight must approve."
"fixture_safety_block","RED_QUEUE_FIXTURE_SAFETY_BLOCKED","Worker fixture must be one exact artifact under the allowed output root."
"codex_auth_or_config","TIM_REQUIRED_CODEX_CLI_AUTH_OR_EXECUTION_APPROVAL","Unclear auth/config/sandbox behavior stops the lane."
"verifier_red","RED_QUEUE_VERIFIER_BLOCKED","Post-run verifier must be GREEN."
