"stop_condition","status","notes"
"branch_containment_failed","not_hit","Deployment branch created from published origin/main."
"codex_cli_config_exact_edit_not_applicable","hit_nonfatal","service_tier was priority, not default; real worker pilot skipped."
"codex_cli_auth_or_execution_required","not_hit","No worker execution attempted."
"api_required","not_hit","No API called."
"background_runner_required","not_hit","No background runner started."
"push_merge_deploy_required","not_hit","No push, merge, or deploy performed."
"product_repo_or_canonical_nwr_required","not_hit","No product repo or canonical NWR mutation performed."
