"stop_condition","status","evidence"
"worker_budget_exceeded","PASS_NOT_HIT","Exactly 3 of 3 approved worker invocations were used."
"codex_cli_auth_or_execution_unclear","PASS_NOT_HIT","All three Codex worker invocations exited 0."
"unexpected_file_touch","PASS_NOT_HIT","Verifier confirmed touched files stayed inside each mission allowed_writes."
"verifier_red","PASS_NOT_HIT","All verifier results were GREEN."
"product_repo_mutation","PASS_NOT_HIT","No product repo path was requested or touched."
"canonical_nwr_mutation","PASS_NOT_HIT","Canonical NWR was not requested or touched."
"api_call","PASS_NOT_HIT","No ChatGPT/OpenAI API or external paid API was called."
"background_runner","PASS_NOT_HIT","Executor ran foreground only."
